audio_file|text|speaker_name
wavs/three_465.wav|I get a $500 million fine.|1
wavs/two_320.wav|We must protect our nations, their interests, and their futures.|1
wavs/five_57.wav|that it's very hard to do business with other countries because they tax our goods at such a high rate.|1
wavs/two_351.wav|Thank you to all involved.|1
wavs/three_1441.wav|I have people come to see me from other lands where this has gone on, especially in South America, Latin America, and they'll say, the same thing happened to my country 20 years ago.|1
wavs/three_2033.wav|You know, they're very hard luck.|1
wavs/one_185.wav|In fact, every time I say I had an uncle who was a great professor at MIT for 35 years, who did a fantastic job in so many different ways academically.|1
wavs/three_1811.wav|He says, Trump was the greatest president in history.|1
wavs/three_2109.wav|Nobody can ramble like this.|1
wavs/three_115.wav|I had generals that I had a hold back, okay?|1
wavs/three_1445.wav|If we don't stop it, this is our last train.|1
wavs/three_595.wav|You just tell me when to sign it.|1
wavs/three_70.wav|And he goes.|1
wavs/three_1924.wav|I said, why are you doing that?|1
wavs/three_1054.wav|But our people are even greater, and none are greater or braver than those who fight for America in uniform.|1
wavs/three_2287.wav|All you have to do is do it in one.|1
wavs/three_58.wav|You know, we have catch and release in there.|1
wavs/three_67.wav|Tijuana became one of the largest cities in the world all of a sudden.|1
wavs/three_1739.wav|He stopped at Paul Ryan, a super rhino.|1
wavs/three_82.wav|Remain in Mexico.|1
wavs/three_1028.wav|Their names are Jameel Shaw, Susan Oliven, Jenna Oliven,|1
wavs/three_2415.wav|Keep the oil.|1
wavs/three_2051.wav|But I call up our first lady, I say, so baby, how good was that?|1
wavs/three_2038.wav|This way you don't have to say good morning all the time, okay?|1
wavs/three_1958.wav|But the most beautiful voice, so professional.|1
wavs/three_1985.wav|And then all of a sudden, 100,|1
wavs/two_122.wav|Drive them out of your Holy Land.|1
wavs/three_1989.wav|Does anybody have a towel?|1
wavs/two_341.wav|Rocket Man is on a suicide mission for himself and for his regime.|1
wavs/three_1079_1.wav|There's not a light anywhere.|1
wavs/three_1246.wav|They weren't working that particular day.|1
wavs/three_249.wav|I said, it's impossible.|1
wavs/three_2119.wav|I took the high stair, you know, I don't like the children.|1
wavs/three_1021_4.wav|All they had to do is leave it alone.|1
wavs/three_711.wav|They notified people in Beverly Hills, you can only use 40 gallons of water.|1
wavs/three_975.wav|We should give our state governors the resources and flexibility they need with Medicaid to make sure no one is left out.|1
wavs/three_1347.wav|So believe me when I offer you another warning, and we've been right about so much, just about everything.|1
wavs/three_2086.wav|He can't do that either.|1
wavs/two_105.wav|This is a battle between good and evil.|1
wavs/three_772.wav|It's going to function well.|1
wavs/three_1530.wav|as president, and I agree with him.|1
wavs/two_356.wav|The Iranian government masks a corrupt dictatorship behind the false guise of a democracy.|1
wavs/three_46.wav|Now, I asked Tom Holman, Brandon Judd, and a person from the State Department, a wonderful woman.|1
wavs/three_2178.wav|We attacked from way far away, sir.|1
wavs/three_2074.wav|But they go out and they say, Donald Trump, headline.|1
wavs/three_1133.wav|They're not sending you.|1
wavs/one_315.wav|Now, I just wanted to really say that I love you.|1
wavs/three_1188.wav|And I said, no, I'm sorry.|1
wavs/three_1783.wav|I said, they're coming through your country and thousands and thousands of people in these caravans.|1
wavs/three_1387.wav|They respected Trump.|1
wavs/three_807.wav|It's going to be more important even than 2016.|1
wavs/three_749.wav|But they sent it out to the Pacific.|1
wavs/two_305.wav|Our citizens have paid the ultimate price to defend our freedom and the freedom of many nations represented in this great hall.|1
wavs/three_1376.wav|He's the crookedest, most incompetent president in the history of our country.|1
wavs/two_47.wav|Instead, we are here to offer partnership based on shared interests and values to pursue a better future|1
wavs/three_1418.wav|Because the fact is, Joe Biden is a threat to democracy.|1
wavs/three_1307.wav|I agree with you.|1
wavs/three_814.wav|That torch is now in our hands, and we will use it to light up the world.|1
wavs/four_50.wav|I beat China all the time.|1
wavs/two_120.wav|Drive them out of your places of worship.|1
wavs/three_1856.wav|You're going to do a remain in Mexico?|1
wavs/three_2276.wav|And they can do their job if they're allowed to do their job, but they don't want to lose their pension.|1
wavs/two_364.wav|The Iran deal was one of the worst and most one-sided transactions the United States has ever|1
wavs/three_1891.wav|And remember when I let them go?|1
wavs/two_237.wav|I ask you to join me to join together, to work together, and to fight together, because united|1
wavs/three_417.wav|I'd go right the hell under there.|1
wavs/one_492.wav|And that's what they want to do is they want to win and they want to win for you.|1
wavs/three_504.wav|When the word got out that we took a very tough action, when kids walk out with that brand new, beautiful $2,000 television, and the police are told, stand down, don't do anything.|1
wavs/two_347.wav|It is time for North Korea to realize that the denuclearization|1
wavs/three_927.wav|But it also has to be fair trade.|1
wavs/three_1389.wav|He said they were afraid of Trump.|1
wavs/two_222.wav|Will we let it destroy the most holy sites?|1
wavs/one_488.wav|We're going to win again, folks.|1
wavs/two_331.wav|and for the imprisonment, torture, killing, and oppression of countless more.|1
wavs/three_2013.wav|But when I imitate him with the stares, if you ever see Secret Service, runs up and grabs him and, you know, helps him off the stage.|1
wavs/three_760.wav|How many people from California know people that get six, seven, eight ballots, okay?|1
wavs/three_469.wav|I said, we're talking about human beings, you know, naively.|1
wavs/three_2213.wav|18 months, we didn't have one soldier killed.|1
wavs/three_972.wav|Secondly, we should help Americans purchase their own coverage through the use of tax credits and expanded health savings accounts.|1
wavs/three_1253.wav|Senate candidate from Virginia, Hung Kao.|1
wavs/three_2126.wav|There's nobody you could hire in Hollywood that looks like this.|1
wavs/three_1507.wav|Now we have the worst border in the history of the world.|1
wavs/three_709.wav|I'm saying, wait a minute, the place is failing.|1
wavs/three_1198.wav|A group of people with common sense to save our country and make America great again.|1
wavs/three_833.wav|The rebellion started.|1
wavs/three_915.wav|In fact, they proudly displayed five of their magnificent motorcycles made in the USA on the front lawn of the White House.|1
wavs/three_1413.wav|A vote for Trump is your ticket back to freedom.|1
wavs/two_245.wav|Fortunately, the United States has done very well since Election Day last November 8th.|1
wavs/three_771.wav|We're going to have a great, everything in our country is going to function properly again.|1
wavs/three_1263.wav|There's a lot of people in this room.|1
wavs/three_2510.wav|They send the water out to the Pacific to protect a little tiny fish.|1
wavs/three_1853.wav|I said, here's what else you're going to do.|1
wavs/three_538.wav|I said, don't even think about it.|1
wavs/three_2467.wav|But he was saying that|1
wavs/one_423.wav|He prayed.|1
wavs/three_2354.wav|But Mexico is our biggest trading partner.|1
wavs/three_1581.wav|With Biden, they answered with hoaxes and witch hunts, censorship, lockdowns, and with total repression.|1
wavs/three_2240.wav|You know, usually get a $500 fine.|1
wavs/three_996_0.wav|But our slow and burdensome approval process at the Food and Drug Administration keeps too many advances, like the one that saved Megan's life, from reaching those in need.|1
wavs/one_303.wav|writes a story about, I took down, I would never do that because I had great respect for Dr. Martin.|1
wavs/three_1672.wav|No, it's crazy what's going on.|1
wavs/three_1437.wav|And they are indeed a threat to democracy.|1
wavs/four_40.wav|And the Mexican government is much smarter, much sharper, much more cunning, and they send the bad ones over because they don't want to pay for them.|1
wavs/three_1491.wav|But if we don't do well in this next election, or if they cheat enough that they can steal it, which is, I think, the only way they can win,|1
wavs/three_262.wav|You say good morning.|1
wavs/one_105.wav|Very, very few people could do the job you people do.|1
wavs/one_509.wav|During this critical mission, his vehicle was struck by explosives.|1
wavs/three_232.wav|The craziest thing, what a waste of money.|1
wavs/three_1628.wav|But it's going to have to be very strong action, and it's going to have to happen fast before our country is just totally overwhelmed.|1
wavs/three_476.wav|They don't know about surrendering, sir.|1
wavs/three_1149.wav|I don't want the enemies and even our allies to know exactly what I'm thinking.|1
wavs/three_1893.wav|I knocked it out in four weeks.|1
wavs/three_1582.wav|Eight years later, the swamp has rejected your righteous pleas to reform, and we have to do this, and we're going to reform, and we're going to have freedom again.|1
wavs/one_248.wav|Did everybody like the speech?|1
wavs/three_580.wav|I said, you're going to pay 25% tax or tariff, call it whatever you want.|1
wavs/three_2298.wav|They lose their pensions.|1
wavs/three_110.wav|Our soldiers knocked the hell out of ISIS.|1
wavs/three_1502.wav|And we're not going to stand for it anymore.|1
wavs/two_291.wav|They are, we the people.|1
wavs/one_163.wav|I didn't want to meet anybody else.|1
wavs/three_633.wav|But I was only a civilian, so I didn't get that much press.|1
wavs/one_235.wav|I believe that|1
wavs/three_2193.wav|I almost, I would have been in trouble with the religious right, but they love me.|1
wavs/one_202.wav|This is a gem.|1
wavs/three_188.wav|There's not a light anywhere.|1
wavs/three_1830.wav|Well, sir, we'd like to remain in Mexico, but we've been trying to get that for years.|1
wavs/three_1881.wav|I proved that with ISIS.|1
wavs/three_1157.wav|He's sending 50 soldiers, our finest, over there.|1
wavs/three_2491.wav|I hope so, because he's destroyed California.|1
wavs/one_527_0.wav|to all of the people, see, you thought I forgot, in our faith community who are here with us tonight, veterans and non-veterans alike.|1
wavs/one_292.wav|So a reporter for Time Magazine, and I have been on their cover like 14 or 15 times.|1
wavs/one_46.wav|Our respect for sovereignty is also a call for action.|1
wavs/three_474.wav|They don't know what a white flag is.|1
wavs/three_936.wav|Nations around the world, like Canada, Australia, and many others, have a merit-based immigration system.|1
wavs/three_700.wav|No, but people all over the world are hearing this, that California... Look, a lot of people think Gavin Newsom is gonna run in a certain way.|1
wavs/three_1761.wav|We have more liquid gold than any other country.|1
wavs/three_1777.wav|Long-time politicians come to see me.|1
wavs/three_884.wav|We will work with our allies, including our friends and allies in the Muslim world, to extinguish this vile enemy from our planet.|1
wavs/three_2331.wav|This was serious cold.|1
wavs/three_2377.wav|May I call our president, please?|1
wavs/three_2480.wav|And you know, it was very interesting because we built the wall, but a lot of people were coming up at the beginning.|1
wavs/three_2509.wav|They take this water and they send it out to the Pacific, way above California.|1
wavs/three_240.wav|Speeches last about, would you say average two, three minutes?|1
wavs/three_598.wav|He was a very confident man, just moments ago.|1
wavs/three_1520.wav|A thousand elements we did.|1
wavs/three_96.wav|And the person from the State Department is a really good woman.|1
wavs/three_1255.wav|He's got some support.|1
wavs/one_44.wav|Those who preach the tenets of these discredited ideologies only contribute to the continued suffering of the people who live under these cruel systems.|1
wavs/three_1091.wav|America is friends today with former enemies.|1
wavs/three_369.wav|They said, it's okay, sir.|1
wavs/three_507.wav|That whole phenomenon would end.|1
wavs/three_495.wav|New York could be solved in a half a day.|1
wavs/three_2296.wav|But they're not allowed to do their job.|1
wavs/three_468.wav|We're ready to send them to hell.|1
wavs/two_315.wav|and nation in this room.|1
wavs/one_74.wav|One of the greatest American patriots, John Adams, wrote that the American Revolution was effective before the war commenced.|1
wavs/three_839.wav|Our military will be given the resources its brave warriors so richly deserve.|1
wavs/three_1109.wav|We will have made America greater than ever before.|1
wavs/three_335.wav|You know this is all genius, okay?|1
wavs/four_26.wav|But we don't know.|1
wavs/three_670.wav|As soon as I was forced out with this rigged election,|1
wavs/three_1321.wav|Stand up, Bannon.|1
wavs/three_1499.wav|our prisoners and our horrible, violent criminals, because they're nicer than the people that are flowing in.|1
wavs/three_1041.wav|and two prior deportations should have never been in our country.|1
wavs/three_186.wav|Now, we're 600 feet off the ground.|1
wavs/three_715.wav|All of the federal government approvals were done.|1
wavs/three_983.wav|So why not join forces and finally get the job done and get it done right.|1
wavs/three_1008.wav|Today, she is the first in her family to graduate not just from high school, but from college.|1
wavs/four_47.wav|When was the last time you saw a Chevrolet in Tokyo?|1
wavs/three_1473.wav|And with me, we have a big voice.|1
wavs/three_1461.wav|And they were saying, he'll never be indicted.|1
wavs/three_1058_7.wav|Better looking than Tom Cruise and taller.|1
wavs/three_1980.wav|Now, usually when you're in these planes, I do it a lot, you have lights bursting, you know, big lights.|1
wavs/three_1402.wav|First time in 72 years that that happened.|1
wavs/three_1614.wav|We had a big border problem, and I solved it.|1
wavs/three_724.wav|Go down, it's the best land there is in the whole country.|1
wavs/five_1.wav|part of our commitment to empowering women all across the globe.|1
wavs/three_1576.wav|They've gorged themselves on the spoils of endless wars.|1
wavs/three_2352.wav|And we saved a lot of businesses.|1
wavs/three_1521.wav|We have a book, The Thousand Things.|1
wavs/three_1050_0.wav|not the ones like Millie and these guys on television.|1
wavs/three_1822.wav|She's been there for over 20 years.|1
wavs/one_236.wav|This group is going to be one of the most important groups in this country toward making us safe, toward making us winners again,|1
wavs/three_2539.wav|And frankly, I believe, you know, I gave a speech up there.|1
wavs/three_2002.wav|And they said, sir, it would not be a good thing to do.|1
wavs/three_1528.wav|I talked to Putin a lot.|1
wavs/three_1899.wav|I said, all right, Cain, what's your first name?|1
wavs/three_483.wav|We have defeated 100- Isn't that a great story?|1
wavs/two_69.wav|It is a tragedy of epic proportions.|1
wavs/three_1874.wav|So after he said, no way, I said way.|1
wavs/three_486.wav|100% of ISIS.|1
wavs/three_2080.wav|But it's very dangerous, you know, because they take it very seriously.|1
wavs/three_1878.wav|"Ma'am, please don't enter our country."""|1
wavs/three_1488.wav|We have to break out of the nightmare that we're in.|1
wavs/three_843.wav|Above all else, we will keep our promises to the American people.|1
wavs/three_1922.wav|Don't worry, we'll get back to the, but this is almost, right now this is more exciting.|1
wavs/three_1979.wav|Yes, sir, we'll be landing momentarily, sir. 100.|1
wavs/two_206.wav|The decisions we make will affect countless lives.|1
wavs/three_1459.wav|Oh no, he'll never be indicted.|1
wavs/one_276.wav|That was 250,000 people.|1
wavs/one_483.wav|They gave all they had, everything, for their comrades, their country, and for victory.|1
wavs/three_142.wav|You know, I flew to Iraq in a plane.|1
wavs/four_15.wav|They're bringing drugs.|1
wavs/one_234.wav|But the fact is, we should have kept the oil.|1
wavs/two_151.wav|We must cut off the financial channels that let ISIS sell oil, let extremists pay their fighters, and help terrorists smuggle their reinforcements.|1
wavs/three_1056.wav|Navy Special Operator, Senior Chief William Ryan Owens.|1
wavs/three_237.wav|But when I imitate him with the stares, if you ever see Secret Service, runs up and grabs him and, you know, helps him off the stage.|1
wavs/one_564_0.wav|loyal to its heroes, and devoted to its creator, then our best days are yet to come.|1
wavs/three_2182.wav|I said, what would you do, General?|1
wavs/three_1081.wav|My job is not to represent the world.|1
wavs/one_171.wav|It was going to be the three of them.|1
wavs/three_588.wav|I said, who the hell negotiated for the United States?|1
wavs/three_1503.wav|As a country, we're not going to stand for it anymore.|1
wavs/two_90.wav|Like all young men and women, they seek great futures to build, great national projects to join, and a place for their families to call home.|1
wavs/two_228.wav|Just imagine what tomorrow could bring.|1
wavs/three_1942.wav|Is there a problem out there, Captain?|1
wavs/three_2312.wav|In fact, if there was, you'll be the first to know, because I will tell you.|1
wavs/three_344.wav|They go step by step.|1
wavs/three_2159.wav|We can do it very quickly.|1
wavs/two_82.wav|The wonders of Giza, Luxor, and Alexandria are proud monuments to that ancient heritage.|1
wavs/three_2042.wav|People love her.|1
wavs/one_212.wav|You know, when I was young and when I was, of course, I feel young.|1
wavs/three_770.wav|We're going to have a great military.|1
wavs/one_0.wav|I want to salute the work of the United Nations in seeking to address the problems that cause people to flee from their homes.|1
wavs/three_322.wav|And then sometimes they get in trouble because they said you were too tough.|1
wavs/one_188.wav|Trust me, I'm like a smart person.|1
wavs/two_301.wav|But we can no longer be taken advantage of or enter into a one-sided deal where the United States gets nothing in return.|1
wavs/three_800.wav|And ladies and gentlemen, for those of you from a beautiful place, South Carolina, go out and vote right now, please.|1
wavs/three_896.wav|We have the worst financial recovery in 65 years.|1
wavs/one_187.wav|And then they say, there's Donald Trump, an intellectual.|1
wavs/three_982.wav|Our citizens deserve this and so much more.|1
wavs/three_1712.wav|Some are dictators, some are prime ministers, but they're tough guys.|1
wavs/three_642.wav|So for years, they'd fight each other.|1
wavs/three_1072.wav|and defeated communism.|1
wavs/three_1854.wav|Remain in Mexico.|1
wavs/two_393.wav|of military operations, not arbitrary benchmarks and timetables set up by politicians.|1
wavs/three_827.wav|For too long, we've watched our middle class shrink as we've exported our jobs and wealth to foreign countries.|1
wavs/one_383.wav|We love our country.|1
wavs/three_696.wav|Do you ever see the things that he's promising?|1
wavs/one_351.wav|You couldn't do anything.|1
wavs/three_1787.wav|But it started with Honduras, it started with El Salvador, but now we're equal opportunity.|1
wavs/three_613.wav|You ever see what happened to Tijuana?|1
wavs/three_1742.wav|They said, sir, if you wait till next year, they said, don't forget I had never done this stuff before, you know, except the president.|1
wavs/one_283.wav|I think most of us like Churchill.|1
wavs/three_1975.wav|Yes, sir, no problem.|1
wavs/five_40.wav|but would arm, supply, and financially support a country that imperils the world with nuclear conflict.|1
wavs/three_37.wav|And on the border, there has never been in his lifetime any president that was even close.|1
wavs/two_84.wav|Iraq was the cradle of civilization and is a land of natural beauty.|1
wavs/three_29.wav|In fact, I asked him for the name of his tailor.|1
wavs/three_1493.wav|We have countries that nobody ever even heard of from all over the world.|1
wavs/one_420.wav|Mad dog matters, right?|1
wavs/three_187.wav|We're flying and the plane is dark with the exception of a tiny little light that they've got on their dashboard underneath everything and totally concealed.|1
wavs/one_536.wav|to stop the Johnson Amendment from interfering with your First Amendment rights.|1
wavs/one_240.wav|And the reason you're my first stop is that, as you know, I have a running war with the media.|1
wavs/one_298.wav|What do you think?|1
wavs/one_147.wav|And by the way, General Flynn is right over here.|1
wavs/three_1487.wav|We're laughed at all over the world.|1
wavs/one_5.wav|We also thank|1
wavs/one_324.wav|Isn't it nice to win?|1
wavs/three_1785.wav|They're going to walk right into our country.|1
wavs/three_1906.wav|You're the man I'm looking for.|1
wavs/three_687.wav|We did a great job.|1
wavs/two_322.wav|threats to sovereignty from the Ukraine to the South China Sea.|1
wavs/three_2532.wav|turn on the shower, ding, now.|1
wavs/three_2517.wav|Who the hell wants to mean you can't use too much water on your hair?|1
wavs/three_1549.wav|And then they say, oh, Putin would say, if you're being nice, I hate|1
wavs/three_1590.wav|I watch ABC, CBS, NBC.|1
wavs/three_1283.wav|The president of Moms for America, Kimberly Fletchner.|1
wavs/three_522.wav|They lose their pensions because our city's all run by Democrats, radical left Democrats for the most part.|1
wavs/three_1159.wav|I am officially running for president of the United States.|1
wavs/three_992.wav|On receiving this news, Megan's dad, John, fought with everything he had to save the life of his precious child.|1
wavs/three_791.wav|I'm going to South Carolina.|1
wavs/one_543.wav|Together, we will protect our families, our nations, and our borders.|1
wavs/one_160.wav|Everybody wanted it.|1
wavs/one_238_0.wav|We have so many problems that are interrelated that we don't even think of, but interrelated to the kind of havoc and fear that this sick group of people has caused.|1
wavs/three_2214.wav|I was the one that had it ready.|1
wavs/three_63.wav|You've got to get the children back to their parents.|1
wavs/three_425.wav|Attack them from, I said, so you'd attack them and it would take you four weeks, maybe more.|1
wavs/three_365.wav|I remember I went into the hangar and there were a lot of, there were hundreds of troops, but they all put on the Make America Great Again.|1
wavs/one_48.wav|In America, we seek stronger ties of business and trade with all nations of goodwill.|1
wavs/three_83.wav|Nobody comes into our country until they're checked at the border.|1
wavs/three_2125.wav|If I were casting a movie on the military, I would pick these guys.|1
wavs/three_359.wav|General, what's your name?|1
wavs/three_663.wav|And they had no money for Hezbollah.|1
wavs/three_1466.wav|But it's had the reverse effect because our poll numbers have gone through the roof.|1
wavs/one_503.wav|Thank you, darling.|1
wavs/three_91.wav|I feel badly for the people, but we don't want to have this contagion in our country.|1
wavs/three_1341.wav|Yes, stand up Gorka, quick, get up.|1
wavs/two_257.wav|Breakthroughs in science, technology, and medicine are curing illnesses and solving problems that prior generations thought impossible to solve.|1
wavs/two_43.wav|I have had the pleasure of welcoming several of the leaders present today to the White House, and I look forward to working with all of you.|1
wavs/three_1429.wav|Or, as I say respectfully to the people from foreign countries, for bullshit.|1
wavs/three_2306.wav|and also Stonehenge.|1
wavs/three_907.wav|My economic team is developing historic tax reform that will reduce the tax rate on our companies so they can compete and thrive anywhere and with anyone.|1
wavs/one_460.wav|So, on behalf of this very large group in this beautiful building, Senior Master Sergeant Miller, happy birthday.|1
wavs/one_110.wav|But you're going to have that.|1
wavs/three_2388.wav|It would be our great honor to adhere to your request for Remain in Mexico.|1
wavs/five_20.wav|that Muslim-majority countries must take the lead in combating radicalization.|1
wavs/two_367.wav|It is time for the entire world to join us in demanding that Iran's government end its pursuit of death.|1
wavs/three_1693.wav|We'll do all of those things.|1
wavs/three_1960.wav|That means you're 1,000 feet over.|1
wavs/three_1275.wav|Eduardo, wherever you are.|1
wavs/one_528.wav|You'll never be forgotten.|1
wavs/three_805.wav|We're going to win it bigger than ever before.|1
wavs/one_551.wav|We all share one home and one glorious destiny, a destiny that's getting better and better every single day.|1
wavs/three_1543.wav|He approves the Russian pipeline, the biggest in the world, billions and billions of dollars a month.|1
wavs/three_1470.wav|I've watched over the years as politicians get indicted, and they start by going to a microphone about two minutes after it happened.|1
wavs/two_112.wav|But the path to peace begins right here, on this ancient soil, in this sacred land.|1
wavs/three_1144.wav|It's coming from more than Mexico.|1
wavs/three_2554.wav|It's common sense.|1
wavs/three_2451.wav|And there were a lot of stories that Iran was unable, and all these terror groups were angry at Iran because they weren't paying them.|1
wavs/three_2452.wav|And the terror groups were all breaking up.|1
wavs/three_1973.wav|500, I say to Captain, are we okay?|1
wavs/one_445.wav|As the Battle of the Bulge began, Harry got his orders to go find tanks at a weapons storage facility.|1
wavs/one_462.wav|Thank you very much, Aaron.|1
wavs/three_740.wav|I'm going to take a shower tonight.|1
