audio_file|text|speaker_name
wavs/three_634.wav|I said, don't go into Iraq.|1
wavs/five_37.wav|It is an eternal credit|1
wavs/three_1620.wav|I want to talk about the border.|1
wavs/three_1362.wav|the suburbs, and when they talk about suburban women, they're going to love me so much.|1
wavs/three_554.wav|This was serious coal.|1
wavs/three_2384.wav|So make it quick, I don't have much time.|1
wavs/three_1288.wav|Can you believe this?|1
wavs/three_2538.wav|We're not going to let them get away with that any longer.|1
wavs/one_242.wav|And they sort of made it sound like I had a feud with the intelligence community.|1
wavs/three_2088.wav|They're just screaming like crazy.|1
wavs/three_2168.wav|Sir, it's our job as a soldier.|1
wavs/two_338.wav|No nation on Earth has an interest in seeing this band of criminals arm itself with nuclear weapons and missiles.|1
wavs/one_330.wav|I appreciate it.|1
wavs/three_346.wav|Now I've just learned that I should not give myself the Congressional Medal of Honor.|1
wavs/three_763.wav|I think I would do very well in California, actually.|1
wavs/three_355.wav|If I were casting a movie on the military, I would pick these guys.|1
wavs/three_1121.wav|We will make America great again.|1
wavs/three_1607.wav|When we win, the curtain closes on their corrupt reign and the sun rises on a bright new future for America.|1
wavs/three_1212.wav|Make Argentina great again.|1
wavs/three_618.wav|We'd love to have you release people that you catch, prisoners and murderers.|1
wavs/three_1134.wav|They're not sending you.|1
wavs/three_155.wav|I said, why are you doing that?|1
wavs/three_1976.wav|We'll be on the ground in just a few minutes, sir.|1
wavs/three_5.wav|They're going to walk right into our country.|1
wavs/three_2259.wav|Well, we got a couple of bullet holes in our... A day later, I get a call.|1
wavs/three_979.wav|Everything that is broken in our country can be fixed.|1
wavs/three_647.wav|And then we come along and we blow up, it's taken over Iraq.|1
wavs/two_111.wav|Terrorism has spread all across the world.|1
wavs/three_1843.wav|And he goes, we're not going to do that.|1
wavs/three_1162.wav|And the Mexican government is much smarter, much sharper, much more cunning, and they send the bad ones over because they don't want to pay for them.|1
wavs/three_1482_0.wav|Once they heard some of these stories that I'm telling you right now, the caravans were much smaller.|1
wavs/three_563.wav|But no, they don't go far.|1
wavs/three_236.wav|But for Biden, you need many.|1
wavs/three_2349.wav|Can you imagine Mexico is our biggest trading partner?|1
wavs/one_54.wav|But they are forgotten no more, and they will never be forgotten again.|1
wavs/three_1379.wav|These are the stakes of this election.|1
wavs/two_67.wav|Some estimates hold that more than 95% of the victims of terrorism are themselves Muslim.|1
wavs/three_52.wav|I said, what would you like?|1
wavs/two_402.wav|We appreciate the efforts of the United Nations agencies that are providing vital humanitarian assistance in areas liberated from ISIS.|1
wavs/one_526.wav|I also want to speak|1
wavs/three_2219.wav|They left it the dark, dogs behind.|1
wavs/one_346.wav|And I promise you, and you see it happening day by day.|1
wavs/three_1351.wav|With four more years of Biden, the hordes of illegal aliens stampeding across our borders will exceed 40 to 50 million people.|1
wavs/three_1529.wav|I got along with him well, although he did announce the other day that he'd much rather see Biden.|1
wavs/three_1239.wav|The former chair of my Council of Economic Advisers, Kevin Hassett, with a nice smile, always has that beautiful smile.|1
wavs/three_1909.wav|Just don't let us do our job.|1
wavs/two_300.wav|The United States will forever be a great friend to the world, and especially to its allies.|1
wavs/three_654.wav|And we're going to put a 100% tariff on anything that gets through.|1
wavs/three_62.wav|I want that with the sick people and with the children.|1
wavs/four_39.wav|Bigger and better and stronger.|1
wavs/three_1070.wav|It is American leadership based on vital security interests that we share with our allies all across the globe.|1
wavs/one_412.wav|The American founders invoked our Creator four times in the Declaration of Independence.|1
wavs/three_2450.wav|They were down to almost nothing.|1
wavs/three_1119.wav|The time for small thinking is over.|1
wavs/two_304.wav|America does more than speak for the values expressed in the United Nations Charter.|1
wavs/three_2247.wav|We're talking about human beings.|1
wavs/three_764.wav|And I think I would do well in a lot of places because it's common sense.|1
wavs/one_192.wav|And then he decided to go into the military.|1
wavs/three_2163.wav|And you might not be able to.|1
wavs/three_226.wav|The fake news media will lead tomorrow.|1
wavs/three_2317.wav|I said, no, you're going to do it.|1
wavs/three_1449.wav|He makes a two minute speech because that's about the only, they couldn't get any more fuel than that.|1
wavs/three_2000.wav|I was so brave.|1
wavs/three_567.wav|Like in school, we want to have choice.|1
wavs/three_2476.wav|We took the money out of the military.|1
wavs/three_204.wav|There's not even a little, what they call a pigeon light.|1
wavs/two_108.wav|We see only that they were|1
wavs/three_178.wav|That means you're 1,000 feet over.|1
wavs/three_1611.wav|It's the most important election.|1
wavs/three_1065.wav|Ryan laid down his life for his friends, for his country, and for our freedom.|1
wavs/three_1855.wav|Nobody comes into our country until they're checked at the border.|1
wavs/three_1575.wav|profits of job-killing trade deals.|1
wavs/three_1666.wav|This is a peaceful protest.|1
wavs/three_1634.wav|I love those young people over there.|1
wavs/three_1237.wav|Former Acting Attorney General, somebody that's been very loyal to the administration and to his country, Matt Whitaker.|1
wavs/three_351.wav|I never had a problem with it, but I'm walking down and I'm looking down and I see these central casting.|1
wavs/three_2194.wav|So I don't, I would have been, please don't do that, sir.|1
wavs/two_264.wav|To put it simply, we meet at a time of both immense promise and great peril.|1
wavs/three_1434.wav|We've never had anything like this in this country.|1
wavs/one_131.wav|And I can understand the other side.|1
wavs/one_284.wav|Doesn't come from our country, but had a lot to do with it.|1
wavs/three_152.wav|a really smart person, can go through various stories, always come back and conclude everything.|1
wavs/three_1730.wav|Hannibal Lecter!|1
wavs/three_2198.wav|I'd hit him from East and West and North and South there.|1
wavs/three_416.wav|I'd hit him from up top.|1
wavs/one_464.wav|Since my very first day in office, we've taken one action after another to make sure that our veterans get the care they so richly deserve.|1
wavs/three_2064.wav|You couldn't hear Barack or Obama, but the name Hussein.|1
wavs/one_69.wav|and their children is a basic one.|1
wavs/three_2174.wav|I say, don't you question what this?|1
wavs/three_754.wav|I always hear Republicans can't win.|1
wavs/three_520.wav|They could stop it everywhere, but they're not allowed to do their job.|1
wavs/two_163.wav|Piety to evil will bring you no dignity.|1
wavs/one_429.wav|One of those soldiers is here with us tonight.|1
wavs/three_1136.wav|They're bringing drugs.|1
wavs/three_43.wav|Then the new guy comes in, the representative.|1
wavs/one_197.wav|And when I told Paul Ryan that I want to do this, I would say he may be the only person that was not totally thrilled.|1
wavs/three_2123.wav|These guys, it's like perfect.|1
wavs/three_1685.wav|Somehow, you know, that's a much harder question than you think because, you know, you're answering all the little, I just say, my plans are very simple.|1
wavs/three_788.wav|They tell you our president is incompetent.|1
wavs/three_1016.wav|But to create this future, we must work with, not against, not against, the men and women of law enforcement.|1
wavs/one_540.wav|And specifically, it just seems it's called radical Islamic terrorism.|1
wavs/three_1272.wav|You know, a lot of it's fake news, so we can't go by everything.|1
wavs/two_249.wav|And because of our regulatory and other reforms, we have more people working in the United States today than ever before.|1
wavs/two_104.wav|in the name of religion, people that want to protect life and want to protect their religion.|1
wavs/three_1082.wav|My job is to represent the United States of America.|1
wavs/three_2277.wav|They don't want to lose everything.|1
wavs/three_488.wav|Matt, probably I won't get the best speaker this year because I went off the stupid teleprompter.|1
wavs/one_556.wav|There are many hills and mountains to climb.|1
wavs/two_142.wav|The Lebanese army is hunting ISIS operatives who try to infiltrate|1
wavs/one_272.wav|something that's amazing because we had, it looked, honestly, it looked like a million and a half people, whatever it was it was, but it went all the way back to the Washington Monument.|1
wavs/three_1030.wav|Jameel's 17-year-old son was viciously murdered by an illegal immigrant gang member who had just been released from prison.|1
wavs/three_785.wav|So I want to apologize for literally not repeating this beautiful speech.|1
wavs/three_1435.wav|And it's a phenomena that's taken place many times, but in third world countries, in banana republics, not in the United States of America.|1
wavs/three_1333.wav|Who made the best speech?|1
wavs/three_652.wav|We're going cold turkey.|1
wavs/three_1952.wav|And I'm getting a little nervous.|1
wavs/one_278.wav|So we caught them, and we caught them in a beauty.|1
wavs/three_12.wav|We have every, we have countries that honestly nobody has ever heard of.|1
wavs/three_705.wav|Sean, we love you very much, Sean, if you happen to be watching.|1
wavs/two_235.wav|These are the desires that burn with a righteous flame in every single human heart.|1
wavs/three_2275.wav|A lot of them have left and they've gone down to other states and they've retired.|1
wavs/three_2079.wav|So when I'm sarcastic, because I'm sort of a sarcastic guy, I find humor in sarcasm.|1
wavs/one_390.wav|The fake media is trying to silence us, but we will not let them, because the people know the truth.|1
wavs/three_2357.wav|It's similar, but not actually.|1
wavs/three_1743.wav|And these guys are bullshitting me.|1
wavs/three_272.wav|Oh, look at that.|1
wavs/three_806.wav|We're going to do things that nobody believed.|1
wavs/three_838.wav|Heroic veterans will get the care they so desperately need.|1
wavs/three_1647.wav|And they're very angry at me because I won an election that wasn't supposed to happen, and they were caught off guard.|1
wavs/three_1017.wav|We must build bridges of cooperation and trust, not drive the wedge of disunity and, really, it's what it is, division.|1
wavs/one_434.wav|Like many of the heroes of his generation, Harry wasn't exactly straightforward about his age when he enlisted in the Army Reserve.|1
wavs/three_55.wav|Well, sir, we'd like to remain in Mexico, but we've been trying to get that for years.|1
wavs/three_1516.wav|But who can win an election when you have that?|1
wavs/three_2430.wav|It's taken over Iraq.|1
wavs/three_1423.wav|Do you know who that is?|1
wavs/three_1815.wav|But Brandon Judd, you have unbelievable people.|1
wavs/three_638.wav|Keep the oil.|1
wavs/three_1544.wav|But he ends the Keystone XL pipeline.|1
wavs/one_402.wav|And we are supporting our incredible police and law enforcement.|1
wavs/five_42.wav|We cannot let|1
wavs/one_439.wav|A couple of months after that, he was in the freezing cold.|1
wavs/three_2087.wav|When I'm in a news conference, people are these maniacs, lunatics are screaming.|1
wavs/one_338.wav|I said, let me out there.|1
wavs/three_848.wav|We've saved taxpayers hundreds of millions of dollars by bringing down the price of fantastic, and it is a fantastic, new F-35 jet fighter.|1
wavs/one_340.wav|I just want to say that your music honors our heroes more eloquently than words could ever do.|1
wavs/three_2077.wav|Look at the great Lou Dobbs.|1
wavs/three_656.wav|He said, all right, well, we won't do it.|1
wavs/three_1642.wav|The level of hatred, there's no way you get fair trials.|1
wavs/three_1722.wav|So we just call it migrant crime.|1
wavs/one_514.wav|Thank you, Luis.|1
wavs/three_1069.wav|Our foreign policy calls for a direct, robust, and meaningful engagement with the world.|1
wavs/one_362.wav|You've shed your blood, you've poured your love, and you've bared your soul in defense of our country, our people, and our great American flag.|1
wavs/three_2472.wav|He probably, you know, lost his chairmanship or whatever he was.|1
wavs/three_349.wav|I took the high stair, you know, I don't like the children.|1
wavs/two_376.wav|And the day will come when the people will face a choice.|1
wavs/three_2489.wav|I may move there myself, actually.|1
wavs/three_402.wav|I say, don't you question what they say.|1
wavs/three_2421.wav|So for years, they'd fight each other.|1
wavs/three_410.wav|He said, I don't mind.|1
wavs/three_1840.wav|Tijuana became one of the largest cities in the world all of a sudden.|1
wavs/one_399.wav|is not your agenda, you've been saying it.|1
wavs/three_2254.wav|They're horrible, horrible people, but they are brave.|1
wavs/two_124.wav|For our part, America is committed to adjusting our strategies to meet evolving threats and new facts.|1
wavs/two_153.wav|It is another historic step in a day that will be long remembered.|1
wavs/three_1147.wav|But we don't know.|1
wavs/three_447.wav|The next day, I get a call that ISIS is really in bad shape.|1
wavs/three_777.wav|He said that very strongly.|1
wavs/one_335.wav|To First Baptist music director Doran Bug,|1
wavs/three_1143.wav|They're sending us not the right people.|1
wavs/three_1140.wav|But I speak to border guards, and they tell us what we're getting.|1
wavs/three_2434.wav|I told China and I told all of the countries, France, everybody, I said, listen, if you buy one barrel of oil, we're not going to do any business.|1
wavs/three_2449.wav|They had no money for anything.|1
wavs/three_1110.wav|For all Americans, this is our vision.|1
wavs/two_148.wav|Our longstanding partnership with Kuwait and Bahrain continue to enhance security in the region.|1
wavs/one_39.wav|I ask every country represented here today to be prepared to do more|1
wavs/three_1700.wav|But it took longer than I thought, but I predicted this.|1
wavs/three_1115.wav|We all salute the same great American flag.|1
wavs/three_305.wav|He thinks Obama is the president.|1
wavs/one_561.wav|of this very important moment in history, and we will prove worthy of the sacrifice that our brave veterans have made.|1
wavs/one_437.wav|Then he immediately asked for a transfer to active duty.|1
wavs/three_2505.wav|All of the federal government approvals were done.|1
wavs/three_345.wav|But what happens, and it's very interesting, we get on the plane, we get off.|1
wavs/two_102.wav|This is not a battle between different faiths, different sects, or different civilizations.|1
wavs/three_54.wav|I want a top 10 list.|1
wavs/three_2294.wav|They could stop it in Chicago.|1
wavs/three_1957.wav|If I had that voice, I would have been president.|1
wavs/three_1750.wav|It was laying there ready to be installed.|1
wavs/three_1857.wav|You're going to do catch and release into Mexico, not into our country.|1
wavs/three_1916.wav|I sat with the pilots, the most handsome human beings.|1
wavs/three_288.wav|I said, wow.|1
wavs/three_2282.wav|When kids walk out with that brand new, beautiful $2,000 television, and the police are told, stand down, don't do anything.|1
wavs/three_173.wav|If you know anything about planes, I call it the computer voice.|1
wavs/three_1021_0.wav|in his lifetime, any president that was even close.|1
wavs/two_307.wav|From the beaches of Europe, to the deserts of the Middle East, to the jungles of Asia, it is an eternal credit|1
wavs/three_501.wav|When you see these department stores where 300, 400, usually kids walk in there with the masks on and rob, destroy the store, billions of dollars.|1
wavs/one_130.wav|This is evil.|1
wavs/three_1537.wav|How do you figure that one, right?|1
wavs/three_2138.wav|I said, you're not supposed to do that.|1
wavs/three_2393.wav|I said, what about catch and release in Mexico?|1
wavs/three_1918.wav|Better looking than Tom Cruise and taller.|1
wavs/three_1001.wav|Education is the civil rights issue of our time.|1
wavs/three_1319.wav|Where's Steve Bannon?|1
wavs/one_385.wav|We love our freedom.|1
wavs/three_162_2.wav|So I'm sort of feeling my way, I get up there.|1
wavs/three_1103.wav|could know in America's 250th year.|1
wavs/one_41.wav|We call for the full restoration of democracy and political freedoms in Venezuela.|1
wavs/two_53_0.wav|When young Muslim men and women should have the chance to build a new era of prosperity for themselves, it has to be done.|1
wavs/three_1350.wav|And just think about it.|1
wavs/three_544.wav|That deal they made with China.|1
wavs/three_1005.wav|As a young girl, Denisha struggled in school and failed third grade twice.|1
wavs/three_2355.wav|I said, you're going to pay 25%|1
wavs/three_1322.wav|Where the hell is Bannon?|1
wavs/four_2.wav|I beat China all the time.|1
wavs/three_516.wav|The same exact thing for the police.|1
wavs/three_48.wav|She's covered Mexico for over 20 years.|1
wavs/three_1799.wav|No, no, no, I will not do it.|1
wavs/three_278.wav|They always show a high heel, you know.|1
wavs/three_485.wav|100% of ISIS.|1
wavs/one_117.wav|We're all on the same wavelength, right?|1
wavs/three_775.wav|And it won't take long.|1
wavs/three_1044.wav|To Jamil, Jenna, Susan, and Jessica,|1
wavs/three_209.wav|And then all of us are 100, and then, bing, bing, beautiful landing like nothing to it.|1
wavs/three_1810.wav|And he does go around saying, I love this guy.|1
wavs/three_2101.wav|I walk out there and it's like a free-for-all.|1
wavs/three_1360.wav|Millions of manufacturing jobs will be choked off into extinction, and you'll have constant blockouts and blackouts and rampant inflation.|1
wavs/one_45.wav|America stands with every person living under a brutal regime.|1
wavs/one_563.wav|As long as our country remains true to its values,|1
wavs/three_727.wav|In Beverly Hills, you pay a fortune in taxes.|1
wavs/three_2134.wav|Then he puts on a Make America Great Again hat.|1
wavs/three_723.wav|and the farmland is barren.|1
wavs/three_2389.wav|Millions of people can stay in our country as a guide.|1
wavs/one_384.wav|We love our families.|1
wavs/three_1711.wav|I know every one of them.|1
wavs/three_2269.wav|We have the greatest law enforcement people in the world, but they're not allowed to do their job.|1
wavs/three_1442.wav|It was the same thing.|1
wavs/three_2496.wav|But he was on Sean Hannity, and he was saying,|1
wavs/one_136.wav|This is something nobody can even understand.|1
wavs/two_138.wav|Every country in the region has an absolute duty to ensure that terrorists find no sanctuary on their soil.|1
wavs/two_256.wav|We live in a time of extraordinary opportunity.|1
wavs/three_1524.wav|Israel would have never happened.|1
wavs/three_525.wav|It's total genius, you know that.|1
wavs/two_140.wav|Jordanian pilots are crucial partners against ISIS in Syria and Iraq.|1
wavs/one_118.wav|Took Brian about 30 seconds to figure that one out, right?|1
wavs/one_287.wav|And as you also probably have read, the prime minister|1
wavs/three_899.wav|And we've lost 60,000 factories since China joined the World Trade Organization in 2001.|1
wavs/three_591.wav|It's so bad underbite.|1
wavs/three_2571.wav|The world is blowing up.|1
wavs/three_2324.wav|The all-electric mandate.|1
wavs/three_243.wav|I remember when he made such a bad State of the Union speech, everything was stumbling, mumbling.|1
wavs/three_2361.wav|I changed the South Korea deal.|1
wavs/three_1375.wav|And a declining crooked Joe.|1
wavs/one_258.wav|They showed a field where there were practically nobody standing.|1
wavs/three_674.wav|They're making so much money, they don't know what to do.|1
wavs/three_2284.wav|That whole phenomenon would end.|1
wavs/three_292.wav|He would always, right, Seb?|1
wavs/three_1251.wav|Thank you, Gary, very much.|1
wavs/one_391.wav|The fake media tried to stop us from going to the White House, but I'm president and they're not.|1
wavs/three_556.wav|Let's say that's five yards.|1
wavs/four_34.wav|Why does he have to make an announcement he's sending 50 people?|1
wavs/three_108.wav|We have the greatest soldiers in the world, but they're not allowed to do their job.|1
wavs/three_1268.wav|They've made a lot of progress, too.|1
wavs/three_594.wav|But I'm ready to sign it.|1
wavs/one_237.wav|toward ending all of the problems.|1
wavs/two_31.wav|Now, there is even more blessed news that I am pleased to share with you.|1
wavs/three_1649.wav|And in 2020, they cheated like dogs.|1
wavs/three_2337.wav|I don't know what the hell the people did.|1
wavs/three_293.wav|Rush would go, Barack Hussein.|1
wavs/three_309.wav|But it's a very serious subject because of what happened.|1
wavs/two_333.wav|We saw it in the assassination.|1
wavs/three_541.wav|Starting Monday morning at 7 o'clock, Mexico is going to pay a tariff of 25% on all of the cars that you stole from our country, by the way.|1
wavs/two_373.wav|And other than the vast military power of the United States, that Iran's people are what their leaders fear the most.|1
wavs/three_532.wav|In fact, if there was, you'll be the first to know, because I will tell you.|1
wavs/three_672.wav|And now they're rich as hell.|1
wavs/three_1312.wav|You look good, Lou.|1
wavs/one_101.wav|We've got to reduce it.|1
wavs/three_1332.wav|We have to get down to business because I want to win the award as the best, whatever the hell they call it, the best speaker, I think they say.|1
wavs/three_1755.wav|I said, they really want an open, nobody could understand it.|1
wavs/three_889.wav|To fill his seat, we have chosen Judge Neil Gorsuch, a man of incredible skill and deep devotion to the law.|1
wavs/three_1885.wav|I had generals that were really tough.|1
wavs/one_381.wav|Tonight, we celebrate veterans.|1
wavs/three_1691.wav|Drill, baby, drill.|1
wavs/two_266.wav|We have it in our power.|1
wavs/three_138.wav|Just don't let us do our job.|1
wavs/two_375.wav|Oppressive regimes cannot endure forever.|1
wavs/three_1876.wav|If you don't approve this and if you don't give us those soldiers, and their soldiers are not politically correct.|1
wavs/three_2518.wav|That would put me out.|1
wavs/three_1536.wav|We defend Germany and Europe, and then they go and pay billions of dollars to the people that we're defending them against.|1
wavs/three_1035.wav|has become a very good friend of mine.|1
wavs/three_2473.wav|But we did a great job.|1
wavs/one_218.wav|When I was young, and I think we're all sort of young, when I was young, we were always winning things in this country.|1
wavs/three_1839.wav|Just ask Tijuana if they were tough.|1
wavs/three_2150.wav|It's all bunkers, real stark, but beautiful in a certain way.|1
wavs/three_1926.wav|And so I said, I want to go sit with the pilots because I often do that.|1
wavs/one_255.wav|I said, wait a minute, I made a speech.|1
wavs/three_2031.wav|And then one of these incredible guys from Secret Service, all these beautiful guys, they run upstage, look at these guys, like,|1
wavs/three_1172.wav|I beat China all the time.|1
wavs/three_1345_3.wav|That whole phenomenon would end.|1
wavs/three_2348.wav|Can you, who the hell knew that?|1
wavs/three_1690.wav|The first and most urgent action when we win will be the sealing of the border, stopping the invasion.|1
wavs/two_303.wav|We also realize that it's in everyone's interest to seek a future where all nations can be sovereign, prosperous, and secure.|1
wavs/three_1285.wav|They just gave me their award.|1
wavs/two_278.wav|We do not expect diverse countries to share the same cultures, traditions, or even systems of government.|1
wavs/three_842.wav|and our neglected inner cities will see a rebirth of hope, safety, and opportunity.|1
wavs/three_897.wav|In the last eight years, the past administration has put on more new debt than nearly all of the other presidents combined.|1
wavs/three_2014.wav|This is what we have negotiating nuclear weapons.|1
wavs/one_104.wav|These are really special, amazing people.|1
wavs/three_2032.wav|They'll run up stage, they'll grab them, and they're not meant to spawn.|1
wavs/three_424.wav|And use a runway and attack the enemy and their savages, sir.|1
wavs/three_1782.wav|But I went to the president of Mexico.|1
wavs/four_16.wav|They're bringing crime.|1
wavs/one_566.wav|Thank you for your great support.|1
wavs/three_408.wav|I said, what would you do?|1
wavs/three_121.wav|We were told four years, and it probably can't be done.|1
wavs/two_348.wav|is its only acceptable future.|1
wavs/three_1085.wav|We have seen the war and the destruction|1
wavs/three_1458.wav|And they would say,|1
wavs/three_1230.wav|Former senator and somebody that's been very nice to me over the years.|1
wavs/one_247.wav|We did a thing yesterday, the speech.|1
wavs/three_2435.wav|We're going cold turkey, which wouldn't have been a bad thing anyway.|1
wavs/three_511.wav|That's why I'm giving immunity to police, because they don't want to get sued.|1
wavs/three_1477.wav|I have a voice that I can explain it all, like the laptop from hell when they impeached me.|1
wavs/three_1225.wav|Vivek, where is Vivek Rameshwamy?|1
wavs/five_45.wav|Out of the goodness of our hearts, we offer financial assistance to hosting countries in the region, and we support recent agreements of the G20 nations|1
wavs/one_418.wav|In World War II, when General George Patton � that was a real general.|1
wavs/four_7.wav|Congratulations.|1
wavs/two_242.wav|As millions of our citizens continue to suffer the effects of the devastating hurricanes that have struck our country,|1
